{
  "status": "PATCH_READY",
  "summary": "Added an explicit one-cycle no-stall latency assertion sequence that checks no same-cycle output, mandatory next-cycle out_valid with correct sum, and no extra-cycle delay for that transaction.",
  "patches": [
    {
      "path": "tests/test_rv_uadd8.py",
      "old_text": "    accepted = []\n\n    async def send_one(a, b, hold_ready_low_cycles=0):\n",
      "new_text": "    accepted = []\n\n    async def assert_one_cycle_latency_no_stall(a, b):\n        exp = uadd8_uadd8_to_u9(a, b)\n        dut.out_ready.value = 1\n\n        while True:\n            await FallingEdge(dut.clk)\n            dut.in_valid.value = 1\n            dut.in_op_a.value = a\n            dut.in_op_b.value = b\n            await Timer(1, unit=\"ns\")\n            ir = int(dut.in_ready.value)\n            ov_same = int(dut.out_valid.value)\n            await RisingEdge(dut.clk)\n            if int(dut.rst_n.value) == 1 and ir == 1:\n                assert ov_same == 0, (\n                    f\"latency violation (early) a={a} b={b} expected_sum={exp} \"\n                    f\"out_valid_seen_same_cycle={ov_same}\"\n                )\n                dut.in_valid.value = 0\n                break\n\n        await FallingEdge(dut.clk)\n        await Timer(1, unit=\"ns\")\n        ov_next = int(dut.out_valid.value)\n        sum_next = int(dut.out_sum.value)\n        assert ov_next == 1, (\n            f\"latency violation (missing t+1 valid) a={a} b={b} expected_sum={exp} \"\n            f\"out_valid_t_plus_1={ov_next}\"\n        )\n        assert sum_next == exp, (\n            f\"latency violation (wrong t+1 data) a={a} b={b} expected_sum={exp} \"\n            f\"out_sum_t_plus_1={sum_next}\"\n        )\n        await RisingEdge(dut.clk)\n\n        await FallingEdge(dut.clk)\n        await Timer(1, unit=\"ns\")\n        ov_late = int(dut.out_valid.value)\n        assert ov_late == 0, (\n            f\"latency violation (late persistence) a={a} b={b} expected single transfer at t+1 \"\n            f\"out_valid_t_plus_2={ov_late}\"\n        )\n\n    async def send_one(a, b, hold_ready_low_cycles=0):\n",
      "finding_indices": [
        0
      ],
      "reason": "Implements explicit temporal checker for exact one-cycle no-stall latency per contract, including fail conditions for early, missing, or delayed behavior."
    },
    {
      "path": "tests/test_rv_uadd8.py",
      "old_text": "    vectors = [((0, 0), \"boundary_00\"), ((255, 0), \"boundary_ff00\"), ((255, 255), \"boundary_ffff\")]\n",
      "new_text": "    await assert_one_cycle_latency_no_stall(17, 23)\n\n    vectors = [((0, 0), \"boundary_00\"), ((255, 0), \"boundary_ff00\"), ((255, 255), \"boundary_ffff\")]\n",
      "finding_indices": [
        0
      ],
      "reason": "Executes the new latency checker in a no-stall scenario before other directed/random flows."
    }
  ],
  "metadata_edits": [],
  "stimulus_intent_edits": [],
  "architecture_conflict": null,
  "known_verification_gaps": []
}
